{
  "accepted": false,
  "errors": [
    "Stack has malformed pinned stack frame"
  ],
  "fixed_bounds": {
    "max_event_bytes": 4194304,
    "max_event_continuations": 4096,
    "max_events": 5000000,
    "max_input_bytes": 536870912,
    "max_line_bytes": 1048576,
    "max_output_bytes": 8388608,
    "max_wait_stack_groups": 4096
  },
  "input": "/home/user/.codex/worktrees/astra-proxy-performance/p2pstream/tmp/continuation-20261016/wan-read-wait-capacity-source/runs/tiny-read-wait-capacity-smoke-3/h1/read-wait-reductions/sequence-9.parsed.txt",
  "input_bytes": 26145119,
  "input_sha256": "22949b93e2f1f54c4470e952b34ed479a56cfa3b8f3e8e7a8aa0a34bd3433879",
  "parsed_tool_status_file": "/home/user/.codex/worktrees/astra-proxy-performance/p2pstream/tmp/continuation-20261016/wan-read-wait-capacity-source/runs/tiny-read-wait-capacity-smoke-3/h1/read-wait-reductions/sequence-9.parser.status",
  "parsed_tool_status_sha256": "9a271f2a916b0b6ee6cecb2426f0b3206ef074578be55d9bc94f6f3fe3ab86aa",
  "region_type": "public-proxy-handler",
  "schema_version": 1,
  "task_type": "wan-read-wait-request"
}
